<DiagDevRespiratoryPanel xmlns:xsi="http://www.w3.org/2001/XMLSchema-instance" xsi:noNamespaceSchemaLocation="DiagDeviceRespiratoryPanel.xsd"><Header><DateTime>2012-11-01T18:24:00</DateTime><SourceID>0</SourceID><SampleID>7883-3-030</SampleID><Device>BioFire FilmArray</Device><DeviceID>00301683</DeviceID><DevicePlexity>17</DevicePlexity><AssaySetID>Respiratory Panel IVD v1.6</AssaySetID><LotID>112912</LotID><Control>1</Control></Header><LineDetail><Test>Adenovirus</Test><LOINC>unknown</LOINC><Result>0</Result></LineDetail><LineDetail><Test>Coronavirus 229E</Test><LOINC>41003-5</LOINC><Result>0</Result></LineDetail><LineDetail><Test>Coronavirus HKU1</Test><LOINC>unknown</LOINC><Result>0</Result></LineDetail><LineDetail><Test>Coronavirus NL63</Test><LOINC>41005-0</LOINC><Result>0</Result></LineDetail><LineDetail><Test>Coronavirus OC43</Test><LOINC>41009-2</LOINC><Result>0</Result></LineDetail><LineDetail><Test>Human Metapneumovirus</Test><LOINC>40978-9</LOINC><Result>0</Result></LineDetail><LineDetail><Test>Human Rhinovirus/Enterovirus</Test><LOINC>unknown</LOINC><Result>1</Result></LineDetail><LineDetail><Test>Influenza A</Test><LOINC>unknown</LOINC><Result>0</Result></LineDetail><LineDetail><Test>Influenza B</Test><LOINC>29907-3</LOINC><Result>0</Result></LineDetail><LineDetail><Test>Parainfluenza Virus 1</Test><LOINC>unknown</LOINC><Result>0</Result></LineDetail><LineDetail><Test>Parainfluenza Virus 2</Test><LOINC>unknown</LOINC><Result>0</Result></LineDetail><LineDetail><Test>Parainfluenza Virus 3</Test><LOINC>unknown</LOINC><Result>1</Result></LineDetail><LineDetail><Test>Parainfluenza Virus 4</Test><LOINC>unknown</LOINC><Result>0</Result></LineDetail><LineDetail><Test>Respiratory Syncytial Virus</Test><LOINC>unknown</LOINC><Result>0</Result></LineDetail><LineDetail><Test>Bordetella pertussis</Test><LOINC>unknown</LOINC><Result>0</Result></LineDetail><LineDetail><Test>Chlamydophila pneumoniae</Test><LOINC>unknown</LOINC><Result>0</Result></LineDetail><LineDetail><Test>Mycoplasma pneumoniae</Test><LOINC>unknown</LOINC><Result>0</Result></LineDetail><Footer><Technician>Operator:</Technician><Status>1</Status><Calibration>0</Calibration><Software>1.3 Build 12/21/2011 2:21:18PM (80)</Software><DeviceVersion>none</DeviceVersion><Diagnostics>none</Diagnostics></Footer></DiagDevRespiratoryPanel>